1117528752387440641,10,76,2019-04-14 20:43:11,"Fans are hopeful Ned Stark could return — dead or alive — for the final season of 'Game of Thrones.' 
1117524210476306433,18,35,2019-04-14 20:25:09,"How long are people in your city expected to live? 
1117520918006382597,29,129,2019-04-14 20:12:04,"""Saturday Night Live"" ponders prison life for celebrities Lori Loughlin, Michael Avenatti, Julian Assange and Tekas… https://t.co/ZGEvjFwtNI"
1117520141577797637,283,1819,2019-04-14 20:08:58,"""Our marriage exists by the grace of a single vote on the US Supreme Court,"" Buttigieg says, referring to his husba… https://t.co/VRlxACW4wW"
1117516582232698881,218,1123,2019-04-14 19:54:50,"Pete Buttigieg says he ""recognizes the audacity"" of running for president as a ""Midwestern millennial mayor,"" but t… https://t.co/2ENBrnaVaz"
1117512712072855553,258,932,2019-04-14 19:39:27,"Buttigieg: ""Freedom does not belong to just one political party ... The chance to live a life of your choosing, in… https://t.co/yA4o8LHbfn"
1117506166588833798,1154,4121,2019-04-14 19:13:27,"LIVE: Pete Buttigieg formally kicks off 2020 presidential campaign with speech in South Bend, Indiana. https://t.co/ckBM3AZ3Gs"
1117505609564348417,24,39,2019-04-14 19:11:14,Lyft is temporarily pulling its electric bicycles from 3 major cities after some riders reported braking issues. https://t.co/c0TqQAHrCr
1117502214904406018,383,0,2019-04-14 18:57:44,"RT @NBCNews: This is Tiger Woods' 5th Masters title, and his first major victory since 2008. https://t.co/GjVSzpdKmC https://t.co/wTMl8XFQs8"
1117499060536119296,4366,15582,2019-04-14 18:45:12,"JUST IN: Speaker Pelosi says President Trump ""must take down his disrespectful and dangerous video"" featuring Rep.… https://t.co/gwvvPPZ6V7"
1117497080010952704,383,2245,2019-04-14 18:37:20,"This is Tiger Woods' 5th Masters title, and his first major victory since 2008. https://t.co/GjVSzpdKmC https://t.co/wTMl8XFQs8"
1117495528600764416,1032,0,2019-04-14 18:31:10,RT @NBCNews: BREAKING: Tiger Woods wins #TheMasters in long-awaited return to major championship glory. 🐯 https://t.co/rNeIKt7ouz
1117494878903197697,1032,4999,2019-04-14 18:28:35,BREAKING: Tiger Woods wins #TheMasters in long-awaited return to major championship glory. 🐯 https://t.co/rNeIKt7ouz
1117489462320168961,19,30,2019-04-14 18:07:04,Philadelphia Eagles cornerback Jalen Mills and Washington Wizards forward Devin Robinson were arrested after a figh… https://t.co/IycEaitV4u
1117487010682478594,123,0,2019-04-14 17:57:19,"RT @NBCSports: Is this real life? You bet it is! 
1117485860906250245,47,0,2019-04-14 17:52:45,"RT @NBCNightlyNews: We're live in Alto, Texas, after severe weather swept across the Southern U.S. https://t.co/qx7Hl02mul
1117484926121795584,43,75,2019-04-14 17:49:02,"The llama population in the US appears to be disappearing. There were nearly 145,000 llamas in the US in 2002. By 2… https://t.co/9QaoHhnP4z"
1117482684694040580,39,0,2019-04-14 17:40:08,"RT @nbcchicago: JUST IN: More than 300 flights canceled at Chicago airports due to snow conditions
1117479886581641217,43,43,2019-04-14 17:29:01,"At least 5 people, including 3 children, were killed Saturday in powerful storms that swept across the southern US,… https://t.co/Bvwk6Olziq"
1117474858068250627,76,262,2019-04-14 17:09:02,"'Game of Thrones' was filmed in more than 49 locations throughout Northern Ireland. 
1117469581218648064,50,95,2019-04-14 16:48:04,American Airlines is extending a cancellation of flights aboard any Boeing 737 Max aircrafts in its fleet until Aug… https://t.co/emTQJ7nF4q
1117464799410102272,138,128,2019-04-14 16:29:04,"Measles outbreak kills 1,200 in Madagascar, where parents want to vaccinate but lack means. https://t.co/l4KkgHbbtW"
1117459255089614848,10,31,2019-04-14 16:07:02,"For 'Game of Thrones' superfans and devoted conspiracy theorists: Similar psychology, different outcomes. https://t.co/qfdojzydu1"
1117453971738775553,29,59,2019-04-14 15:46:02,Opinion | Susan B. Sorenson: The NRA says guns — not VAWA — keep women safe. Here's what the research says.… https://t.co/W27gmChkzz
1117450193782308865,51,103,2019-04-14 15:31:02,The Lyrid meteor shower is back. Here's how to see April's shooting stars. https://t.co/yAhPlplwWZ - @NBCNewsMACH
1117445164170194945,25,36,2019-04-14 15:11:02,"Three children and one woman were killed Saturday in powerful storms that swept across the southern US, authorities… https://t.co/3VV72ri5lt"
1117440401059799041,82,157,2019-04-14 14:52:07,"A Florida man was killed by a large bird he was breeding after he fell, and the cassowary clawed him to death. https://t.co/frlj3bPGae"
1117435351449075714,88,111,2019-04-14 14:32:03,A Pennsylvania officer will not be charged after he shot and wounded an inmate because he apparently thought he was… https://t.co/Y6sy3zHXbi
1117429564983205888,43,202,2019-04-14 14:09:03,"Morehouse College, the uniquely black, male alma mater of Martin Luther King Jr., Spike Lee and Samuel L. Jackson,… https://t.co/8eD30aFsdP"
1117424029932118016,106,0,2019-04-14 13:47:04,"RT @chucktodd: .@JayInslee responds to Pres. Trump suggesting the country should send migrants to sanctuary cities: ""While they're waiting…"
1117423787295768577,72,113,2019-04-14 13:46:06,A good Samaritan picking up people's tabs and giving out money at a Florida Waffle House was shot dead in a fight t… https://t.co/aL43GIJheP
1117418498161037313,52,257,2019-04-14 13:25:05,"Kate McKinnon as Lori Loughlin said, ""You think prison is hard, I have done 68 Hallmark movies."" https://t.co/TuJCJ6BhVy"
1117412709924995072,72,196,2019-04-14 13:02:05,"Pancreatic cancer is often deadly, but a new approach is raising hope https://t.co/T7QV22y42r"
1117412250032250880,40,0,2019-04-14 13:00:15,RT @TODAYshow: Tonight is the beginning of the end with the final season of #GameofThrones! @WillieGeist sat down with #KitHarington best k…
1117411909232418816,23,0,2019-04-14 12:58:54,"RT @MeetThePress: THIS MORNING: @KellyannePolls joins @chucktodd. Plus, an exclusive interview with 2020 presidential candidate @JayInslee.…"
1117408427091927040,110,192,2019-04-14 12:45:04,Active shooter drills are scaring kids and may not protect them. Some schools are taking a new approach. https://t.co/RWsJJCTAxl
1117405156772065280,27,57,2019-04-14 12:32:04,Researchers found the active ingredient in tooth whiteners can eat away at the material covering the sensitive stru… https://t.co/D0npBk3aEr
1117401140910526465,61,138,2019-04-14 12:16:06,Black soccer stars have had enough of racism on the field https://t.co/Q863Z5xq77
1117397860788649984,55,370,2019-04-14 12:03:04,Kim Kardashian West told Vogue that she decided last summer to begin a 4-year apprenticeship with a law firm in San… https://t.co/EvstLuZor8
1117392310621413376,14,52,2019-04-14 11:41:01,"Opinion | Ani Bundel: ""JK Rowling taught her readers to embrace an open, progressive society. A decade later, it's… https://t.co/wa1HsY4DGJ"
1117390317815308289,70,223,2019-04-14 11:33:06,Why Roald Dahl begged parents to vaccinate children for measles. https://t.co/NEiQaBe0ag - @TODAYshow
1117387293805948928,22,49,2019-04-14 11:21:05,"Why ""lawnmower parenting"" is like robbing your kids — and how to actually help them. https://t.co/zSk2qmKtU9 - @NBCNewsBETTER"
1117383027670355969,29,85,2019-04-14 11:04:08,Disney announced at the company's investor day that Disney+ will be available starting Nov. 12 for $6.99 per month… https://t.co/61CNWxPpsC
1117375465310883845,33,60,2019-04-14 10:34:05,"Dietary supplements not only didn't extend life, but can be harmful at high doses, new study finds. https://t.co/kLeTY7FpV1"
1117367659325272064,45,111,2019-04-14 10:03:04,The Navy will reportedly allow transgender sailors to dress in accordance with their gender identity while off duty… https://t.co/O4QkpdWNl5
1117360112102969344,24,32,2019-04-14 09:33:04,"The company says that due to a manufacturing problem, water can get into the light assemblies through some seals an… https://t.co/8cMkXfBZkn"
1117352553321201664,25,76,2019-04-14 09:03:02,"Women who had C-sections were 80% more likely to have complications than those who delivered vaginally, researchers… https://t.co/wqqLaDDiM9"
1117344756626075648,30,67,2019-04-14 08:32:03,"More than 37,000 Americans have been killed in high-speed crashes in the past 25 years, and automakers are under in… https://t.co/4oPih2csbJ"
1117340475470561280,7,21,2019-04-14 08:15:03,"“We need to begin charting the course in a different way going forward,” Marc Pritchard, the chief brand officer of… https://t.co/il2u6Tw2sF"
1117337470478188544,19,46,2019-04-14 08:03:06,Soccer in the spotlight as Europe grapples with racism on and off the field https://t.co/m7r7HXdzwN
1117329908118827008,32,61,2019-04-14 07:33:03,Southwest is removing flights with the Boeing 737 Max aircraft from its schedule until August. https://t.co/BQUENtMdkM
1117322363627016192,41,53,2019-04-14 07:03:04,Nearly 900 workers fell to their death in 2017 — the most since the U.S. started tracking such accidents nearly thr… https://t.co/LplPLJPbCo
1117315065278025734,5,25,2019-04-14 06:34:04,The state House of Representatives voted 103-0 for a budget that includes funding for 500 additional corrections of… https://t.co/8nmrvsCnnP
1117307262744317952,33,94,2019-04-14 06:03:04,Los Angeles camp aims to inspire young female firefighters https://t.co/txKTZPHC1B
1117301143544135681,30,107,2019-04-14 05:38:45,"""Saturday Night Live"" ponders prison life for celebrities Lori Loughlin, Michael Avenatti, Julian Assange and Tekas… https://t.co/cVgH2m2gcx"
1117299967889235969,22,108,2019-04-14 05:34:05,Netflix is releasing a new documentary on Beyoncé and her iconic Coachella performance. https://t.co/J01wdxluQk
1117292165061853186,29,37,2019-04-14 05:03:05,"The number of young kids who went to U.S. emergency rooms because they swallowed toys, coins, batteries and other o… https://t.co/NS5I388IxZ"
1117284365829120002,31,52,2019-04-14 04:32:05,"Two Oregon college students allegedly managed to scam Apple out of nearly $900,000 through a scheme involving count… https://t.co/dEWy5ZqG1u"
1117277054137970689,42,99,2019-04-14 04:03:02,Record 17-ft. python captured in Florida's Big Cypress National Preserve. https://t.co/adBl9eugfB
1117269262727614464,102,128,2019-04-14 03:32:04,A good Samaritan picking up people's tabs and giving out money at a Florida Waffle House was shot dead Sunday in a… https://t.co/fautQnkRYF
1117261959253188608,51,59,2019-04-14 03:03:03,"Asian American, Pacific Islander, and multiracial college students are more likely than white students to have cons… https://t.co/AE7c2A8go8"
1117254671851294722,28,54,2019-04-14 02:34:06,"A woman has sued the Houston Astros for more than $1 million, saying that a T-shirt cannon by the team's mascot at… https://t.co/jU3WVMv6aJ"
1117253634281095168,23,30,2019-04-14 02:29:58,"Two children were killed in Texas as a series of storms, including reports of tornadoes, swept through the state Sa… https://t.co/hM9hpEogYB"
1117246871746043904,35,54,2019-04-14 02:03:06,A professional actor is among 3 people who pleaded guilty to an extortion plot aimed at getting the former owner of… https://t.co/fnq6TnRmbA
1117246447743901696,180,324,2019-04-14 02:01:25,"A Florida man was killed by a large bird he was breeding after he fell, and the cassowary clawed him to death. https://t.co/E5YxTIRya4"
1117243437449994242,258,180,2019-04-14 01:49:27,"Hundreds of FBI and police officers' personal information, including home addresses and phone numbers, was posted o… https://t.co/Bc1cvvUcdp"
1117241580317040640,46,68,2019-04-14 01:42:04,"With the world’s population projected to reach almost 10 billion by 2050, experts are looking for ways to make sure… https://t.co/QXHPGYwbxj"
1117239064594456576,38,257,2019-04-14 01:32:04,"Miami Heat star Dwyane Wade shared his support publicly for his 11-year-old son, who appeared at the annual Miami B… https://t.co/LmHWbX7Zjc"
1117236300107718658,22,101,2019-04-14 01:21:05,"Opinion | Anthea Butler: ""Isn’t it past time to more broadly consider women with gray hair just as sexy as men?""… https://t.co/lf3DSwXTQY"
1117232013310869504,21,65,2019-04-14 01:04:03,"After spotting herself on a ""Top Ten Wanted"" list, Chloe Jones posted: ""Do you guys do pickup or delivery??"" https://t.co/8kLuOXSK6s"
1117227474440654848,21,64,2019-04-14 00:46:01,What the world's happiest country can teach Americans. https://t.co/P0PvRpPsP1 - @NBCNewsBETTER
1117224215277703170,17,49,2019-04-14 00:33:04,"""The owner decided that he did not want to evacuate, our engine captain went to find a police officer to enforce th… https://t.co/qviZ4908Xo"
1117223919470219265,154,137,2019-04-14 00:31:54,A Pennsylvania officer will not be charged after he shot and wounded an inmate because he apparently thought he was… https://t.co/EA4Xv5T7zf
1117216651039137794,21,53,2019-04-14 00:03:01,"A 90-year-old Florida woman who won a $278M Powerball ticket 6 years ago, is suing her son and his financial advise… https://t.co/H508uDXwUP"
1117213439754108929,681,1796,2019-04-13 23:50:15,"Morehouse College, the uniquely black, male alma mater of Martin Luther King Jr., Spike Lee and Samuel L. Jackson,… https://t.co/EiWzf0jpVp"
1117211874741968896,40,95,2019-04-13 23:44:02,Why robotic pets may be the next big thing in dementia care. https://t.co/26f2RCewJK - @NBCNewsMACH
1117209115808477184,29,72,2019-04-13 23:33:04,"This ""Flintstones"" house has been declared a ""public nuisance"" by the California town of Hillsborough https://t.co/u1oGu54OeI"
1117207787426205696,56,49,2019-04-13 23:27:47,"Border Patrol agents dropped off 83 asylum seekers in Las Cruces, New Mexico, after 95 were brought to the city on… https://t.co/XOjcIj8xsh"
1117204354707095552,12,49,2019-04-13 23:14:09,"Fans are hopeful Ned Stark could return — dead or alive — for the final season of 'Game of Thrones.' 
1117201561065861123,129,622,2019-04-13 23:03:03,San Jose City Council votes to hang rainbow flags at airport Chick-Fil-A in support of LGBTQ rights. https://t.co/gtmRryE8WS
1117197287648845826,17,56,2019-04-13 22:46:04,Opinion | Steve Krakauer: Rep. Ocasio-Cortez is a perfect role model for millennials — but not for what she does be… https://t.co/Dr50oWFSrU
1117193769059852288,35,129,2019-04-13 22:32:05,A flight attendant had a bad day at the office when she spilled a tray of drinks on her airline's CEO. https://t.co/cmSEgm3Hjm
1117189986456100864,9,16,2019-04-13 22:17:03,How a startup wants to use AI to catch shoplifters in the act. https://t.co/V9IQmXJDta - @NBCNewsMACH
1117186718795554816,35,39,2019-04-13 22:04:04,"""I could see the live stream video of myself looking at his phone,"" Nealie Barker said. ""I had this horrible, sinki… https://t.co/bhTnHA1plU"
1117181173988581386,16,46,2019-04-13 21:42:02,How to cope when a friend breaks up with you. https://t.co/jodtvK1t4f - @NBCNewsBETTER
1117177154884775936,17,49,2019-04-13 21:26:04,Sen. Booker kicks off campaign in hometown of Newark; promises to stay above the fray. https://t.co/Hdd7sCwYt6
1117176447221813248,28,0,2019-04-13 21:23:15,"RT @NBCNightlyNews: Celebrating the Coal Miner's Daughter:
1117172615687344133,45,214,2019-04-13 21:08:02,"When a hotel employee exchanged card tricks with a young guest, he had no idea just how much the kind gesture would… https://t.co/S1SCagWj2h"
1117168987773775872,40,0,2019-04-13 20:53:37,"RT @NBCNightlyNews: WATCH: Country music legend Loretta Lynn reflects on what it was like getting on stage for the first time.
1117167843970310146,49,182,2019-04-13 20:49:04,"The Alabama gymnast who broke both her legs during a competition wants people to stop sharing her injury video: ""My… https://t.co/ueWdX9HGAc"
1117162821396193282,19,30,2019-04-13 20:29:07,"In early February, as Lou Gehrig’s disease left him fighting to breathe, George Gallegos had a decision to make: Wa… https://t.co/Ndp8knUdiB"
1117157023601299466,12,15,2019-04-13 20:06:04,Opinion | Cal Newport: Tech has turned us into screen addicts. Now it's time to delete all our apps. https://t.co/kti78YJeuj - @NBCNewsTHINK
1117152244959412229,40,73,2019-04-13 19:47:05,"The Stratolaunch is now the largest airplane in the world to fly, with a wingspan measuring 385 feet — wider than a… https://t.co/uk5bgcZjLm"
1117147702188548098,44,65,2019-04-13 19:29:02,Does marijuana cause lung cancer? Doctors call for more research. https://t.co/hjFlmAeU8W
1117142426588712965,24,74,2019-04-13 19:08:04,"After spotting herself on a ""Top Ten Wanted"" list, Chloe Jones posted: ""Do you guys do pickup or delivery??"" https://t.co/TRVm6FbHiP"
1117137388914999296,34,47,2019-04-13 18:48:03,"Amid New York City's worst measles outbreak in 30 years, health advocates are pointing to what they believe is the… https://t.co/35P5d5ADrp"
1117131860549697536,36,83,2019-04-13 18:26:05,New human species discovered in Philippines cave. https://t.co/51Z0li2RIe - @NBCNewsMACH
1117127330449768451,185,641,2019-04-13 18:08:05,"""Members of Congress have a duty to respond to the President's explicit attack today,"" Rep. Ocasio-Cortez said on T… https://t.co/Y7PMqYXJz2"
1117123057494241283,62,99,2019-04-13 17:51:06,The boy was thrown off the third floor of the largest shopping mall in the country by a stranger. The young victim… https://t.co/3xRhti3SGA
1117119474451271682,238,727,2019-04-13 17:36:52,"LIVE: Sen. Booker holds presidential campaign kickoff rally in Newark, New Jersey. https://t.co/IEUaMnn6PA"
1117119279562928128,39,188,2019-04-13 17:36:05,"When a hotel employee exchanged card tricks with a young guest, he had no idea just how much the kind gesture would… https://t.co/9ZofZ55Rdm"
1117113222237126656,34,100,2019-04-13 17:12:01,"This ""Flintstones"" house has been declared a ""public nuisance"" by the California town of Hillsborough. https://t.co/QbddNUvcbE"
1117108186727813120,39,66,2019-04-13 16:52:01,"When Louisiana State Fire Marshal Butch Browning announced an arrest in the ""suspicious"" torching of 3 historically… https://t.co/MNUwMCpaMY"
1117103167873875968,29,46,2019-04-13 16:32:04,Designating Iran's Revolutionary Guard as a terror group could jeopardize US troops. https://t.co/NCSDYjTKSM
1117096879072993282,24,65,2019-04-13 16:07:05,"Medical aid in dying, also known as ""death with dignity,"" has given thousands of terminally ill Americans the optio… https://t.co/E54YOC6z3O"
1117091587329273857,28,53,2019-04-13 15:46:03,Opinion | Susan B. Sorenson: The NRA says guns — not VAWA — keep women safe. Here's what the research says.… https://t.co/R8hMKLL1bz
1117087056545628160,13,26,2019-04-13 15:28:03,Job-related falls should be easy to prevent. But workers keep dying anyway. https://t.co/5YvrifdgxR
1117083042810667013,32,37,2019-04-13 15:12:06,Ukrainian ambassador's vehicle attacked in London outside embassy; no injuries were reported after police opened fi… https://t.co/Fk8SCqCZvA
1117077995603337216,159,441,2019-04-13 14:52:03,House Democrats give IRS until April 23 to hand over President Trump's tax returns after Treasury Sec. Mnuchin said… https://t.co/OssNmgGvCR
1117072709735862273,59,62,2019-04-13 14:31:02,"Puerto Rico will have to wait until May for Congress to resume discussions over disaster relief funding, deepening… https://t.co/yV78kUpRMk"
1117067938887020550,16,34,2019-04-13 14:12:05,"Opinion | Catherine Bartlett: If Daenerys Targaryen can teach Jon Snow not to fear dragons, you can learn not to fe… https://t.co/vbu64RaiXM"
1117061398972989442,68,293,2019-04-13 13:46:06,"Katie Bouman, a researcher who helped create the first image of a black hole, gained internet fame for her role in… https://t.co/OwcLaP4BLb"
1117055761773989889,65,240,2019-04-13 13:23:42,"The Alabama gymnast who broke both her legs during a competition wants people to stop sharing her injury video: ""My… https://t.co/qwSeQpwB86"
1117050082266877953,45,56,2019-04-13 13:01:08,"In West Texas, an oil boom is creating a major problem for producers and locals alike: wasting natural gas by burni… https://t.co/OLhgkezXF2"
1117044769132351489,38,84,2019-04-13 12:40:01,"About 1 in 5 Americans suffer from allergies triggered by pollen, and if you’re one of them, you might feel like yo… https://t.co/s8A7mOUic1"
1117039499438120961,107,536,2019-04-13 12:19:04,"When a hotel employee exchanged card tricks with a young guest, he had no idea just how much the kind gesture would… https://t.co/LAEJP4Wpz7"
1117034728559906818,11,27,2019-04-13 12:00:07,"What is whey protein? The benefits and dangers, according to a nutritionist - @TODAYShow https://t.co/oDIVFpRG2m"
1117031028990861313,24,35,2019-04-13 11:45:25,"Japan says U.S. serviceman kills woman, self in Okinawa https://t.co/Iy66Y9oWig"
1117029681017098241,14,38,2019-04-13 11:40:04,"Opinion | Nicky Woolf: ""The Wikileaks founder did deserve to be arrested and should face justice, just not by the U… https://t.co/veRJQpfqqC"
1117024660594528256,126,77,2019-04-13 11:20:07,U.S. health officials say overdose deaths involving the herbal supplement kratom have caused 91 deaths in 27 states. https://t.co/5rC8MNXKpr
1117019876705615872,30,49,2019-04-13 11:01:06,"Women who had C-sections were 80% more likely to have complications than those who delivered vaginally, researchers… https://t.co/jmN4yxhACq"
1117014585351995392,26,70,2019-04-13 10:40:04,"When George Gallegos was diagnosed with ALS, he found himself facing a grim future with a disease that slowly kills… https://t.co/0zd1EMeaLz"
1117009551189008385,12,41,2019-04-13 10:20:04,"Opinion | Ani Bundel: ""The 'Star Wars' franchise continues to delight and surprise fans with a combination of power… https://t.co/7BFadaTGg4"
1117004773285347329,14,13,2019-04-13 10:01:05,Here’s what happens if you don’t file your taxes before April 15 - @CNBC https://t.co/VXJGY0e0nh
1116999485207515138,15,24,2019-04-13 09:40:04,A Massachusetts high school baseball coach is facing an assault charge and has been suspended after allegedly grabb… https://t.co/ypMDRn76bi
1116996975843577856,25,32,2019-04-13 09:30:06,Head of Sudan's military council steps down a day after coup https://t.co/4o9co4suj5
1116994455742099456,32,85,2019-04-13 09:20:05,"Now that they can observe these bizarre objects directly, experts say we can expect an avalanche of new observation… https://t.co/PtVanI3n9L"
1116992365296746497,24,34,2019-04-13 09:11:47,Analysis: Benjamin Netanyahu's re-election may doom the two-state solution https://t.co/KDYqZ2jbGw
1116989445885001728,10,18,2019-04-13 09:00:11,"While you may want to spend your tax refund on a source of instant gratification, these money moves are smarter,… https://t.co/ETeSG3VNcw"
1116984382802333696,45,52,2019-04-13 08:40:04,The boy was thrown off the third floor of the largest shopping mall in the country by a stranger. The young victim… https://t.co/Kz1yPCEVXl
1116979086763659265,268,1121,2019-04-13 08:19:01,"""Members of Congress have a duty to respond to the President's explicit attack today,"" Rep. Ocasio-Cortez said on T… https://t.co/S0I2YQbw5g"
1116976841032634375,26,30,2019-04-13 08:10:05,"North Korean leader Kim Jong Un said he is open to a third summit with President Donald Trump, the country's state-… https://t.co/MLylC6eeMl"
1116974840492298241,11,20,2019-04-13 08:02:09,"They walk, run, spin and lift weights. Candidates are trying to connect with voters by staying fit on the campaign… https://t.co/vpf324HAVi"
1116969528586571776,15,39,2019-04-13 07:41:02,CEO Mary Barra all but confirmed America's longest-running sports car is about to get a long-awaited upgrade.  https://t.co/rBk7dcikdE
1116963504697819136,25,60,2019-04-13 07:17:06,"Fees would go toward projects in underprivileged communities where some descendants live, including Maringouin, Lou… https://t.co/UwLIwRGZ6K"
1116959237865967617,16,45,2019-04-13 07:00:09,"The country’s oil and gas sector employs 170,000 people and is the top moneymaker, producing 17% of Norway’s GDP. https://t.co/rSilD91vML"
1116954187382906881,97,328,2019-04-13 06:40:04,"The government and industry proponents project that the cannabis program could generate $100,000,000 in new tax rev… https://t.co/a4aSIGTefj"
1116949160874397696,31,48,2019-04-13 06:20:06,The two doctors were traveling in a government vehicle with a police escort when two Toyota Probox cars blocked the… https://t.co/WLJ77x2C8d
1116944863914799106,54,45,2019-04-13 06:03:02,The recall comes after at least 32 babies died after rolling over in the sleeper. 4.7 million sleepers have been so… https://t.co/R0XQZcbAtI
1116939093026463746,38,159,2019-04-13 05:40:06,"""Any creature, no matter how big, no matter how small, they deserve to have a perfect life,"" 10-year-old Alora Wood… https://t.co/sjrXHWgqAJ"
1116934059823968256,24,63,2019-04-13 05:20:06,Chicago's top prosecutor asked the Cook County Inspector General to investigate how her office handled the Jussie S… https://t.co/5Cnr0laZiY
1116930170580021248,38,42,2019-04-13 05:04:38,Dozens of federal and local law enforcement personnel were searching for a 15-year-old boy who was in the middle of… https://t.co/x3IQmHGcSb
1116926496025784321,43,26,2019-04-13 04:50:02,"Fisher-Price recalled nearly 5,000,000 infant sleepers, after more than 30 babies died in them over a 10-year perio… https://t.co/oVCkO1HJVV"
1116923979921534976,60,189,2019-04-13 04:40:02,"During a lesson on Autism Awareness Month, 11-year-old Rumari asked his teacher if he could speak about what it’s l… https://t.co/efZou21ghW"
1116918947822149633,21,78,2019-04-13 04:20:03,Netflix’s new series “Special” is an unconventional comedy about a gay man with cerebral palsy. The show has eight… https://t.co/87OiLuRZBg
