1121447794735230977,28,39,2019-04-25 16:16:04,"Chinese scientists insert human brain gene into monkeys, sparking ethical debate. https://t.co/njWN7ttRO3  - @NBCNewsMACH"
1121446285662400517,115,221,2019-04-25 16:10:04,"The Mueller report details how McGahn received at least 2 phone calls with Pres. Trump in which the president ""dire… https://t.co/XdPkIFJsop"
1121445027190837248,17,22,2019-04-25 16:05:04,"Suspected Parkland shooter set to receive more than $432,000 on life insurance policy; may lose public defender. https://t.co/6hjTn0QPPt"
1121440245545930759,20,45,2019-04-25 15:46:04,Opinion | Susan B. Sorenson: The NRA says guns — not VAWA — keep women safe. Here's what the research says.… https://t.co/DbkCp3tjM3
1121436462870880256,22,22,2019-04-25 15:31:02,FBI and IRS agents searching Baltimore Mayor Catherine Pugh's homes and City Hall. https://t.co/cLuLsVmhCz
1121436121915961346,7,56,2019-04-25 15:29:41,@MSNBC @KellyO https://t.co/hso8vFR7Xc
1121434700873129984,28,55,2019-04-25 15:24:02,"UPDATE: Parents of Andrew Freund, the 5-year-old boy who was found dead Wednesday about a week after the father rep… https://t.co/FWuMQzmPn7"
1121432703499419649,53,66,2019-04-25 15:16:06,"Chinese scientists insert human brain gene into monkeys, sparking ethical debate. https://t.co/T6jDtAKu1w  - @NBCNewsMACH"
1121431353856278528,93,182,2019-04-25 15:10:44,"Woman wakes up after 27 years in a coma; doctor who treated her describes the ""ecstatic"" moment she suddenly woke u… https://t.co/n8bsBUBdwJ"
1121429927256035328,25,29,2019-04-25 15:05:04,"Suspected Parkland shooter set to receive more than $432,000 on life insurance policy; may lose public defender. https://t.co/5IaUYgscNv"
1121428651076145152,88,66,2019-04-25 15:00:00,"2 killed as tornado hits Ruston, Louisiana; significant damage reported, as multiple tornadoes hit Louisiana and Te… https://t.co/5GT1pwq02d"
1121426143612145664,21,26,2019-04-25 14:50:02,Coming to store shelves: Cameras that guess your age and gender. https://t.co/GxUP30AYfl
1121424194355462145,68,109,2019-04-25 14:42:17,"BREAKING: Maryland Gov. Hogan: Baltimore Mayor Pugh ""has lost the public trust. She is clearly not fit to lead. For… https://t.co/xUOQeEOMYQ"
1121424138785230855,42,57,2019-04-25 14:42:04,"Chinese scientists insert human brain gene into monkeys, sparking ethical debate. https://t.co/AAPDlZCjtk  - @NBCNewsMACH"
1121421872250355712,11,36,2019-04-25 14:33:04,FBI and IRS agents searching Baltimore Mayor Catherine Pugh's homes and City Hall. https://t.co/ytulkQusAt
1121418850531147776,66,135,2019-04-25 14:21:03,"After voters approve restoring voting rights to felons, Republican-controlled Florida House approves a bill that ai… https://t.co/VbFus77sOn"
1121416846174035968,37,63,2019-04-25 14:13:05,"Chinese scientists insert human brain gene into monkeys, sparking ethical debate. https://t.co/BfF0ITHZc5  - @NBCNewsMACH"
1121414824167186432,21,30,2019-04-25 14:05:03,"Suspect Parkland shooter set to receive more than $432,000 on life insurance policy; may lose public defender. https://t.co/J9eECLz4Az"
1121412766399647744,8,23,2019-04-25 13:56:53,Marc Mauer of the group Sentencing Project said the drop is the result of a change in sentencing guidelines for dru… https://t.co/IRxmV4xY0d
1121411802343059456,31,58,2019-04-25 13:53:03,"Despite claims by the Trump administration that undocumented immigrants commit a disproportionate number of crimes,… https://t.co/LXBjWBVynr"
1121411190599692288,8,20,2019-04-25 13:50:37,"After decades of increases, the latest figures show that the incarceration rate — the number of prisoners compared… https://t.co/9Yr9lJZ6Rj"
1121410679267889157,26,69,2019-04-25 13:48:35,"The number of people serving prison or jail sentences in the US dropped 10 percent over the decade ending in 2017,… https://t.co/VWLjDhYR2L"
1121408415178350593,56,130,2019-04-25 13:39:35,An Arkansas nurse and Sunday school teacher was sentenced to 16 years in prison for murdering her husband after dis… https://t.co/fxNxYP3it1
1121403760893485056,14,31,2019-04-25 13:21:05,FBI and IRS agents searching Baltimore Mayor Catherine Pugh's homes and City Hall. https://t.co/brrn2oGyi2
1121403722012274688,16,92,2019-04-25 13:20:56,"⚡️ “@KellyO looks back on 25 years and counting at @NBCNews”
1121399979564765184,20,29,2019-04-25 13:06:04,"Suspect Parkland shooter set to receive more than $432,000 on life insurance policy; may lose public defender. https://t.co/LdrPMrOnZG"
1121398975356178437,39,43,2019-04-25 13:02:04,"Chinese scientists insert human brain gene into monkeys, sparking ethical debate. https://t.co/Sd6wJDLhi7  - @NBCNewsMACH"
1121394943661047808,18,37,2019-04-25 12:46:03,"After noticing the toilet seat had been moved, a Pittsburgh woman says she “had an intuition” that someone else was… https://t.co/2Y3l1O6QqV"
1121393068903751680,22,77,2019-04-25 12:38:36,"In a tweet, President Trump welcomes Joe Biden to the 2020 presidential race with insults, and a note that ""if you… https://t.co/wud5yqbuXy"
1121391171413192704,234,705,2019-04-25 12:31:04,Analysis: Critics say the president is abusing his authority so badly that he could be impeached for actions that h… https://t.co/Tl6UaeEj63
1121389191168966657,126,202,2019-04-25 12:23:12,JUST IN: FBI and IRS agents searching Baltimore Mayor Catherine Pugh's homes and City Hall. https://t.co/IzuDzOMDXX
1121388396658741250,92,368,2019-04-25 12:20:02,Joe Biden launches 2020 presidential run. https://t.co/I3YixFZ0XO
1121387407650299904,77,115,2019-04-25 12:16:07,Democratic presidential hopefuls have publicly declared that they would not take advantage of illegally obtained in… https://t.co/2rLRutIaGB
1121384372148625408,34,46,2019-04-25 12:04:03,"Chinese scientists insert human brain gene into monkeys, sparking ethical debate. https://t.co/fC2iCmOzJb  - @NBCNewsMACH"
1121382625883693057,14,27,2019-04-25 11:57:06,"Suspect Parkland shooter may lose public defender over insurance inheritance; set to receive more than $432,000. https://t.co/xDl07xH3HA"
1121381359002509312,9,22,2019-04-25 11:52:04,".@NBCNewsBETTER: When it comes to value for the money, strong job markets, quality of life and being desirable plac… https://t.co/miLmd3FRMI"
1121379346399342592,69,282,2019-04-25 11:44:05,"At TIME magazine gala, comedian Hasan Minhaj calls out Jared Kushner to his face for his ties to Saudi Crown Prince… https://t.co/ufXVKp1BoH"
1121378578791321602,11,22,2019-04-25 11:41:02,"Opinion | Ani Bundel: ""JK Rowling taught her readers to embrace an open, progressive society. A decade later, it's… https://t.co/5cQAsKOAJ4"
1121377844913954816,80,0,2019-04-25 11:38:07,"RT @TODAYshow: Measles cases in the US have now climbed to the highest levels in 25 years. Nationwide, the CDC reports 695 cases of the dis…"
1121376058882887683,1091,3311,2019-04-25 11:31:01,Analysis: Critics say the president is abusing his authority so badly that he could be impeached for actions that h… https://t.co/JEIdA9z1qw
1121373749780070400,24,0,2019-04-25 11:21:50,RT @TODAYshow: There are currently severe thunderstorm warnings from Mississippi through Louisiana. @dylandreyernbc is tracking the storms…
1121373557907447808,8,20,2019-04-25 11:21:04,"Why ""lawnmower parenting"" is like robbing your kids — and how to actually help them. https://t.co/BPtSfrcdOR - @NBCNewsBETTER"
1121372916313096193,454,0,2019-04-25 11:18:32,RT @TODAYshow: Breaking this morning: Former Vice President Joe Biden formally enters the 2020 race for president using a sharply-worded vi…
1121370775271956481,136,458,2019-04-25 11:10:01,BREAKING: Joe Biden launches 2020 presidential run. https://t.co/tMly9lzLVe
1121368539015806976,42,44,2019-04-25 11:01:08,"Chinese scientists insert human brain gene into monkeys, sparking ethical debate. https://t.co/Y96mWCVbDj  - @NBCNewsMACH"
1121366006016950272,77,101,2019-04-25 10:51:04,President Trump’s re-election campaign has not publicly stated that it will not use hacked materials to its advanta… https://t.co/tvyewVLRVb
1121363180708605953,17,0,2019-04-25 10:39:50,"RT @TODAYshow: Today on TODAY: @NMoralesNBC's exclusive interview with Bode and Morgan Miller.
1121362047961370624,127,639,2019-04-25 10:35:20,"A spokesperson for former President Obama sends statement on Biden presidential run, says ""President Obama has long… https://t.co/NVyYHvcFf4"
1121360453454696448,31,40,2019-04-25 10:29:00,"Food processing plant employee killed after falling into industrial-sized meat grinder, coroner says; employee disc… https://t.co/iaK0Sywvj4"
1121354420162371585,66,104,2019-04-25 10:05:02,Former intelligence officials say the Mueller report shows the Trump campaign left itself wide open to Russians. https://t.co/9M2WkRokpv
1121354095363858434,482,1957,2019-04-25 10:03:44,BREAKING: Joe Biden launches 2020 presidential run. https://t.co/DE382ko8Lh
1121353677665644545,15,21,2019-04-25 10:02:05,"Opinion | Aramide A. Tinubu: Disney needs to teach people about its racist cartoons, not hide them away.… https://t.co/E7ZKnofMzM"
1121348395787071490,29,74,2019-04-25 09:41:05,An Arkansas nurse and Sunday school teacher was sentenced to 16 years in prison for murdering her husband after dis… https://t.co/BT8XVHI2VK
1121345376118816768,22,16,2019-04-25 09:29:05,"Food processing plant employee killed after falling into industrial-sized meat grinder, coroner says; employee disc… https://t.co/kXCKKoRVIb"
1121343858791591936,25,87,2019-04-25 09:23:04,Racist who orchestrated one of the most gruesome hate crimes in recent US history has been executed in Texas for th… https://t.co/bS6FagF7b8
1121341354649559040,9,21,2019-04-25 09:13:07,".@NBCNewsBETTER: When it comes to value for the money, strong job markets, quality of life and being desirable plac… https://t.co/frlw9oF341"
1121338578418765825,13,39,2019-04-25 09:02:05,"Britney Spears addresses rumors in the fan-led #FreeBritney movement: ""Your love and dedication is amazing, but wha… https://t.co/yfv5QOkZpp"
1121333282212384769,61,52,2019-04-25 08:41:02,An Arkansas nurse and Sunday school teacher was sentenced to 16 years in prison for murdering her husband after dis… https://t.co/iaSf6gcNPX
1121330510846996481,13,17,2019-04-25 08:30:01,"Food processing plant employee killed after falling into industrial-sized meat grinder, coroner says; employee disc… https://t.co/7iabXOtPtL"
1121328501175586817,43,143,2019-04-25 08:22:02,Racist who orchestrated one of the most gruesome hate crimes in recent US history has been executed in Texas for th… https://t.co/RkqBjWoOq5
1121326245495627776,9,19,2019-04-25 08:13:04,".@NBCNewsBETTER: When it comes to value for the money, strong job markets, quality of life and being desirable plac… https://t.co/1HdSUIxcSt"
1121318187637846016,25,50,2019-04-25 07:41:03,An Arkansas nurse and Sunday school teacher was sentenced to 16 years in prison for murdering her husband after dis… https://t.co/qNtXGsT0F3
1121315427513192449,38,34,2019-04-25 07:30:05,"Food processing plant employee killed after falling into industrial-sized meat grinder, coroner says; employee disc… https://t.co/E0LMAoq4JW"
1121313393544183808,38,98,2019-04-25 07:22:00,Racist who orchestrated one of the most gruesome hate crimes in recent US history has been executed in Texas for th… https://t.co/tmZgfrvt5Q
1121311394547359744,7,21,2019-04-25 07:14:04,".@NBCNewsBETTER: When it comes to value for the money, strong job markets, quality of life and being desirable plac… https://t.co/VWIiEEEnKu"
1121308130367897600,87,231,2019-04-25 07:01:05,"""I don't want him to be remembered as a kid who was bullied for being gay and who took his own life,"" Camika Shelby… https://t.co/dOG4ZbL8Bt"
1121305859940864003,19,36,2019-04-25 06:52:04,"Thousands of unexploded relics of World War II's extensive aerial bombardment are found in Germany every year, even… https://t.co/hekCRAj1D5"
1121303102626377728,10,32,2019-04-25 06:41:07,The #BeforeILetGo challenge is the latest news for an already buzzing Beyhive. - @NBCBLK https://t.co/b64r5IPD3f
1121300331135152129,55,58,2019-04-25 06:30:06,A deputy at a Florida jail was arrested after he made an inmate drop to the ground and do pushups as punishment for… https://t.co/nWCWeTq24T
1121296543297015808,16,19,2019-04-25 06:15:03,"With dozens of police and immigration checkpoints dotting the highways, many migrants now view the train as a safer… https://t.co/tM9Ctnq9hb"
1121293025819410432,18,38,2019-04-25 06:01:04,"Opinion | Ani Bundel: ""'Cobra Kai' turned out to be far better than it had any right to be. But it seems clear that… https://t.co/YOIKqDMOxx"
1121289996588208128,29,56,2019-04-25 05:49:02,President Trump vowed to take on pharmaceutical companies in his administration's pursuit to end the opioid epidemi… https://t.co/pcSGSeVhxN
1121288735260401664,57,123,2019-04-25 05:44:01,"""We send spaceships to other planets, but we can't build a bridge between the community and the police,"" a New Have… https://t.co/txthAuyYMd"
1121287743252910080,18,52,2019-04-25 05:40:05,Millie Brown founded ‘Tears of a Mother's Cry’ to help comfort mothers who have lost their children to gun violence. https://t.co/QeTDVxLWZw
1121285717081174017,16,59,2019-04-25 05:32:02,What the world's happiest country can teach Americans. https://t.co/hzZyPTL15r - @NBCNewsBETTER
1121281200256114689,37,54,2019-04-25 05:14:05,"With the world’s population projected to reach almost 10 billion by 2050, experts are looking for ways to make sure… https://t.co/6sn7GMxYDJ"
1121280197754597377,33,73,2019-04-25 05:10:06,"There are earthquakes and moonquakes, and now a NASA spacecraft has detected what's believed to be a ""marsquake"" on… https://t.co/jJJr421GNY"
1121277686301827072,20,22,2019-04-25 05:00:07,"Many reports describe Chinese railroad workers lowering themselves in woven baskets, placing explosives to blast ou… https://t.co/BVSF7jeQdS"
1121276168391536640,17,49,2019-04-25 04:54:05,Carolina Hurricanes eliminate defending Stanley Cup champs Washington Capitals in Game 7 in double OT to advance to… https://t.co/so2YpKLer9
1121274905767628802,35,71,2019-04-25 04:49:04,"This is the gospel according to the Church of Safe Injection: People will use drugs anyway, so society should make… https://t.co/myzaD66byn"
1121272900840034304,13,33,2019-04-25 04:41:06,".@NBCNewsBETTER: When it comes to value for the money, strong job markets, quality of life and being desirable plac… https://t.co/9ErQSZsIj5"
1121266091253280768,26,27,2019-04-25 04:14:02,The Boy Scouts of America denies it is hiding the names of scout leaders accused of sex abuse from law enforcement https://t.co/nC0u4WsUCd
1121265091331145733,26,49,2019-04-25 04:10:04,Stakes high as Supreme Court takes on LGBTQ employment cases - @NBCOUT https://t.co/8r01G1wQQn
1121265087933820929,138,122,2019-04-25 04:10:03,"Greenland's ice sheet is melting 6x faster than it was in the 1980s, and the meltwater is directly raising sea leve… https://t.co/BQswNi3SlY"
1121263331120177152,34,39,2019-04-25 04:03:04,"Food processing plant employee killed after falling into industrial-sized meat grinder, coroner says; employee disc… https://t.co/iugEVz5uyT"
1121261057023062017,1123,2896,2019-04-25 03:54:02,Analysis: Critics say the president is abusing his authority so badly that he could be impeached for actions that h… https://t.co/19HIy94vZe
1121247975207047168,25,38,2019-04-25 03:02:03,"The beef and dairy industry in California generates 50% of the state's output of methane, a potent greenhouse gas.… https://t.co/uFxXv6BfaH"
1121243451939545089,29,50,2019-04-25 02:44:05,"“This is our 20th annual report, and Los Angeles has ranked number one for ozone pollution in all but one of those… https://t.co/nqFEn8entj"
1121243197253070848,67,108,2019-04-25 02:43:04,The World Health Organization said that children under 1 should not have any screen time while those under 5 should… https://t.co/isi3BPA4qp
1121237540483289090,62,65,2019-04-25 02:20:35,"New cases of measles reported in New York, New Jersey and California bring the total number of infections in the U.… https://t.co/Otryns05Vd"
1121232618811473922,19,67,2019-04-25 02:01:02,"Opinion | Michael Arceneaux: ""We have enough false prophets out there, so we needn’t entertain more — no matter how… https://t.co/t9L8iSdtJr"
1121230156234776576,20,45,2019-04-25 01:51:15,"Of the 1,300,000 people who applied to an income-based repayment plan in 2018, almost 3/4 earned less than $100,000… https://t.co/TYJIDXVpH8"
1121229854865801216,30,35,2019-04-25 01:50:03,"Nearly 100,000 undocumented students graduate from high school each year, but under the Trump admin., they cannot a… https://t.co/BDW6pkJ7mk"
1121228892369330178,19,43,2019-04-25 01:46:14,"Income-based repayment plans help reduce defaults, experts say, but the process of enrolling is difficult, with pap… https://t.co/UE26Md9oFO"
1121227621310713857,13,28,2019-04-25 01:41:10,"For those who can't afford to make their regular payment, the government offers payment plans that are tied to thei… https://t.co/0lLYpJbJtz"
1121227333808132098,23,87,2019-04-25 01:40:02,"A woman who accused R. Kelly of sexual abuse has won a civil case by default against the singer, after he failed to… https://t.co/P326XwDjbf"
1121226355012538368,32,76,2019-04-25 01:36:09,"Warren’s proposal would wipe out the first $50,000 of debt for anyone with a household income below $100,000 per ye… https://t.co/vxWazONPoF"
1121225088114671616,37,51,2019-04-25 01:31:07,Most Americans with student debt are young. But adults 60 and older — who either struggled to pay off their own loa… https://t.co/7fxqUumBdB
1121223772982382592,93,219,2019-04-25 01:25:53,"1 in 5 adult Americans carry student loan debt.
1121217541358215168,139,273,2019-04-25 01:01:07,An Arkansas nurse and Sunday school teacher was sentenced to 16 years in prison for murdering her husband after dis… https://t.co/Ja09v3OHG8
1121212243000135680,51,64,2019-04-25 00:40:04,"Body of 5-year-old Andrew Freund found; parents who reported him missing charged with murder, police say. https://t.co/wM2SpSocdy"
1121209756025274368,359,967,2019-04-25 00:30:11,BREAKING: Racist who orchestrated one of the most gruesome hate crimes in recent US history has been executed in Te… https://t.co/d2qRE8FeOZ
1121208721961570304,74,63,2019-04-25 00:26:05,"Makers of e-cigarettes claim that their products are safe, but a study published Wednesday shows that dozens of pop… https://t.co/WfSVrVwCbC"
1121206760822444032,41,79,2019-04-25 00:18:17,"After noticing the toilet seat had been moved, a Pittsburgh woman says she “had an intuition” that someone else was… https://t.co/b8V0EMW6nj"
1121202730876440576,178,400,2019-04-25 00:02:16,"The California Senate approves a bill that would update the state's anti-discrimination law, possibly becoming the… https://t.co/sid77HhoWD"
1121198158594416640,33,78,2019-04-24 23:44:06,Why robotic pets may be the next big thing in dementia care. https://t.co/jBf9gGTzdH - @NBCNewsMACH
1121194126014406658,13,30,2019-04-24 23:28:05,"Michel Cohen tries to walk back parts of his guilty plea in recorded phone call, report says https://t.co/J4Zuf3HXaG"
1121189600268050433,31,43,2019-04-24 23:10:06,The Boy Scouts of America denies it is hiding the names of scout leaders accused of sex abuse from law enforcement https://t.co/CHAdUiGyxB
1121185321658437632,32,179,2019-04-24 22:53:05,"'Jeopardy!' champ James Holzhauer passes $1,000,000 mark; continues march toward records set by Ken Jennings. https://t.co/tn54zQKXe0"
1121183565184684032,10,37,2019-04-24 22:46:07,Opinion | Steve Krakauer: Rep. Ocasio-Cortez is a perfect role model for millennials — but not for what she does be… https://t.co/gnVhAkUfa4
1121179796791279621,4,0,2019-04-24 22:31:08,RT @NBCNightlyNews: NOW: @LesterHoltNBC anchors @NBCNightlyNews from Rockefeller Center for most of our viewers in the Eastern and Central…
1121176250008113154,6,15,2019-04-24 22:17:03,How a startup wants to use AI to catch shoplifters in the act. https://t.co/kz4zjsusF2 - @NBCNewsMACH
1121174254475784193,16,39,2019-04-24 22:09:07,"Beto O'Rourke wins the endorsement of the original 'Psychedelic Warlord,' David Brock https://t.co/PnaUcOH4rr"
1121168955266170888,40,75,2019-04-24 21:48:03,"Food processing plant employee killed after falling into industrial-sized meat grinder, coroner says; employee disc… https://t.co/cCkllNX714"
1121167460076523521,12,35,2019-04-24 21:42:07,How to cope when a friend breaks up with you. https://t.co/Rw7aO9wcIf - @NBCNewsBETTER
1121167113673224196,27,0,2019-04-24 21:40:44,RT @NBCNightlyNews: Tonight on @NBCNightlyNews: Cars that can start with your smart phone and facial recognition that can detect whether yo…
1121165433753808896,176,167,2019-04-24 21:34:04,"Greenland's ice sheet is melting 6x faster than it was in the 1980s, and the meltwater is directly raising sea leve… https://t.co/xSPnio1j0R"
1121163418990522368,22,85,2019-04-24 21:26:03,Houston high school principal has implemented a dress code for parents because she says it is necessary to establis… https://t.co/2wOS5uFvk8
1121159900267188225,39,43,2019-04-24 21:12:05,"Body of 5-year-old Andrew Freund found; parents who reported him missing charged with murder, police say. https://t.co/oiMrcL9bKP"
1121157327564963841,122,0,2019-04-24 21:01:51,"RT @NBCNews: BREAKING: Body of 5-year-old Andrew Freund found; parents who reported him missing charged with murder, police say. https://t.…"
1121156370550726657,68,116,2019-04-24 20:58:03,Facebook says that a federal investigation into its privacy practices could cost the company as much as $5B. https://t.co/EpAyNOc5Ve
1121153859336978435,56,137,2019-04-24 20:48:04,UN recommends no screen time for babies and only 1 hour for kids under 5. https://t.co/9CltlpuMyP
1121151348186259456,45,44,2019-04-24 20:38:06,"Food processing plant employee killed after falling into industrial-sized meat grinder, coroner says; employee disc… https://t.co/bwXnJwNYqV"
1121147824916316160,36,40,2019-04-24 20:24:06,"Body of 5-year-old Andrew Freund found; parents who reported him missing charged with murder, police say. https://t.co/buqLL3YJl0"
1121147070960812033,95,0,2019-04-24 20:21:06,RT @NBCNewsTech: BREAKING: Facebook says that a federal investigation into its privacy practices could cost the company as much as $5B. htt…
1121144287952031744,104,91,2019-04-24 20:10:02,"Greenland's ice sheet is melting 6x faster than it was in the 1980s, and the meltwater is directly raising sea leve… https://t.co/SUNew00Gp2"
1121140966407245824,136,492,2019-04-24 19:56:50,Racist who orchestrated one of the most gruesome hate crimes in recent US history is set to be executed Wednesday f… https://t.co/vgazLjehE1
1121134737974857728,42,41,2019-04-24 19:32:05,"Food processing plant employee killed after falling into industrial-sized meat grinder, coroner says; employee disc… https://t.co/SCfM9wRBB2"
1121131955704217601,122,154,2019-04-24 19:21:02,"BREAKING: Body of 5-year-old Andrew Freund found; parents who reported him missing charged with murder, police say. https://t.co/wCaGcsjamv"
1121130198542503936,45,39,2019-04-24 19:14:03,UPDATE: Measles cases in US spike to highest level since 2000. https://t.co/4nlkumVXCX
1121129573096349699,98,121,2019-04-24 19:11:34,The anti-vaccination movement has become one of the WHO’s top 10 threats to public health. @NBCNews' Stay Tuned is… https://t.co/dpw5LePucM
1121127190802894848,21,66,2019-04-24 19:02:06,"Britney Spears addresses rumors in the fan-led #FreeBritney movement: ""Your love and dedication is amazing, but wha… https://t.co/qnREVRr2O2"
1121123665268092928,78,96,2019-04-24 18:48:05,"Food processing plant employee killed after falling into industrial-sized meat grinder, coroner says; employee disc… https://t.co/zY4RCDSa2f"
1121119636437835776,102,368,2019-04-24 18:32:05,"At TIME magazine gala, comedian Hasan Minhaj calls out Jared Kushner to his face for his ties to Saudi Crown Prince… https://t.co/ZATjfonNc3"
1121116629834899461,23,134,2019-04-24 18:20:08,"Wisconsin man, 24, comes forward to claim $768,000,000 Powerball jackpot. https://t.co/m4jambAB07"
1121113593750216705,23,118,2019-04-24 18:08:04,"'Jeopardy!' champ James Holzhauer passes $1,000,000 mark; continues march toward records set by Ken Jennings. https://t.co/0t6a4BMkcm"
1121112101769089025,910,0,2019-04-24 18:02:08,RT @MSNBC: LIVE: 2020 presidential candidates participate in the #SheThePeople2020 forum. https://t.co/izIzuxH20p
1121110577856819200,20,40,2019-04-24 17:56:05,The stakes for an accurate 2020 census count are high for jurisdictions with immigrant and Latino communities. Many… https://t.co/oNcx0cSXeL
1121108254157729792,24,77,2019-04-24 17:46:51,LIVE: President Trump and the First Lady speak at drug abuse and addiction summit. https://t.co/AMMnEpwqhq
1121108004944973824,62,64,2019-04-24 17:45:52,"Food processing plant employee killed after falling into industrial-sized meat grinder, coroner says; employee disc… https://t.co/EIQzPTpkbb"
1121104530274508801,23,71,2019-04-24 17:32:03,Houston high school principal has implemented a dress code for parents because she says it is necessary to establis… https://t.co/9p3YnlCe8S
1121102398620094465,19,51,2019-04-24 17:23:35,"Of the 1,300,000 people who applied to an income-based repayment plan in 2018, almost 3/4 earned less than $100,000… https://t.co/KLOkjjEEpC"
1121102024861540353,17,68,2019-04-24 17:22:06,"Opinion | Michael Arceneaux: Kanye West's Sunday Service isn't his redemption, it's just more egotism.… https://t.co/Pc9wlfLc9T"
