1119322573668356096,11,49,2019-04-19 19:31:12,"“It’s hard to imagine it’s already been 20 years,” a visibly emotional Sean Graves told @NBCNews. “I was 15 years o… https://t.co/GmgYS0SAc8"
1119321787131678720,23,36,2019-04-19 19:28:04,"This flu season was to be short and mild in the US, but a surprising second viral wave made it the longest in 10 ye… https://t.co/E9mNpA6gWN"
1119319003619454976,97,231,2019-04-19 19:17:01,"WATCH: At Northern Ireland vigil for journalist Lyra McKee, who was shot and killed last night while reporting on a… https://t.co/92e6gY5Yg5"
1119317636314214401,28,0,2019-04-19 19:11:35,"RT @Annie_Rose23: Yuma, Arizona - embedded with @CBPArizona as they patrol the border - they say their sector receives hundreds of migrants…"
1119315743697510400,7,16,2019-04-19 19:04:03,The Slants founder Simon Tam details Supreme Court case in new memoir. https://t.co/AU3SBH8vzj
1119314939276079104,15,58,2019-04-19 19:00:52,"""It seems like every month, there’s a new tragedy of some kind somewhere around,” says Rick Townsend, whose daughte… https://t.co/qWpFAS5QB9"
1119311205133357058,6,36,2019-04-19 18:46:01,The streaming rights for the NFL may be the next target for Amazon and Disney's streaming services. https://t.co/3o33GNk7EK
1119308700978753536,114,303,2019-04-19 18:36:04,Israeli scientists create world's first 3D-printed heart using human cells. https://t.co/3V0RW4LzE0 - @NBCNewsMACH
1119307433405571072,30,0,2019-04-19 18:31:02,"RT @NBCNewsMACH: The world's glaciers hold lots of nuclear fallout. Here's what might happen when they melt.
1119305662658482177,44,189,2019-04-19 18:24:00,"WATCH: While campaigning, Beto O'Rourke hands his microphone to a woman who interrupts him to fact-check him on acc… https://t.co/HAkn1IA1Of"
1119303516475023361,18,68,2019-04-19 18:15:28,"""It seems like every month, there’s a new tragedy of some kind somewhere around,” says Rick Townsend, whose daughte… https://t.co/tyKahdt9ac"
1119302653333397506,32,47,2019-04-19 18:12:02,"Notre Dame official says ""computer glitch"" could be fire culprit. https://t.co/QaeB23u4gY"
1119297704486739971,21,79,2019-04-19 17:52:22,"For those affected by Columbine, the massacre is both past and ever-present, a wound that never really heals becaus… https://t.co/4UbYi2G73E"
1119296338645090305,125,574,2019-04-19 17:46:57,"JUST IN: California parents who beat, starved and held 12 of their children captive inside their home sentenced to… https://t.co/rVme887Enf"
1119295370000052224,10,17,2019-04-19 17:43:06,"Dining room deregulation: FDA may soon revamp rules for cherry pie, milk, French dressing. https://t.co/3g2RcsUshA"
1119292488148291585,156,355,2019-04-19 17:31:39,"With the 20th anniversary of the Columbine shooting looming, several grieving parents and survivors sat down with… https://t.co/EvaF52Ypof"
1119288806019162112,121,118,2019-04-19 17:17:01,"The drinking water in Paradise, California, where 85 people died in the worst wildfire in state history, is contami… https://t.co/vmULAbWKMJ"
1119285058278502400,57,281,2019-04-19 17:02:07,A woman who said she took a photo of a man and a little girl playing outside France’s Notre Dame Cathedral shortly… https://t.co/HmPtv3fzTg
1119283826017091584,16,27,2019-04-19 16:57:14,https://t.co/LvdGA9jS54
1119282030943047681,24,96,2019-04-19 16:50:06,"Advisers to former VP Biden are finalizing plans for the launch of his 2020 presidential campaign next week, ending… https://t.co/bgltUOgYnu"
1119277751360471040,288,707,2019-04-19 16:33:05,"Pressed this morning to acknowledge she misled the public with her ""countless"" FBI agents comment, Press Sec. Sande… https://t.co/WiyxHxQGxT"
1119274480759660545,26,75,2019-04-19 16:20:05,"Opinion | Lizzo: Self-care has to be rooted in self-preservation, not just mimosas and spa days. https://t.co/CtKINUvPoO - @NBCNewsTHINK"
1119271696886829056,23,41,2019-04-19 16:09:02,"A 10-year-old South Carolina girl died from a rare brain condition and not as a result of a classroom fight, offici… https://t.co/wQsByWARZb"
1119271158606700546,23,69,2019-04-19 16:06:53,"NEW: Sen. Bennet, potential 2020 presidential candidate, has been given a clean bill of health after undergoing sur… https://t.co/O7wb1MovvZ"
1119269191377391616,12,53,2019-04-19 15:59:04,Opinion | Ronda Racha Penrice: Beyoncé's 'Homecoming' on Netflix is an ode to black culture — and HBCU greatness.… https://t.co/smhyjWtsq2
1119268832344981504,186,430,2019-04-19 15:57:39,Mueller report mentions that the special counsel made criminal referrals in 14 cases. Only 2 are publicly known. Wh… https://t.co/yUxzmPFj4V
1119266807712485376,93,211,2019-04-19 15:49:36,"Mueller on concluding not to prosecute, but also not to exonerate, on obstruction:
1119265919895781376,15,37,2019-04-19 15:46:04,Opinion | Susan B. Sorenson: The NRA says guns — not VAWA — keep women safe. Here's what the research says.… https://t.co/HOgXMUM9D1
1119264378078072832,27,61,2019-04-19 15:39:57,Mueller explains in his conclusion that his report does not draw “ultimate conclusions” about President Trump’s con… https://t.co/yDXPqIZhYz
1119261354320379904,50,74,2019-04-19 15:27:56,"This is what the redacted Mueller report says about Jared Kushner, Ivanka Trump and Donald Trump Jr. https://t.co/uGPMRLwX77"
1119260129176764416,12,15,2019-04-19 15:23:04,"Voters relieved, but unmoved, after redacted Mueller report release. https://t.co/S055SvKxzf"
1119259112485867525,12,28,2019-04-19 15:19:01,A woman who pleaded guilty to reckless driving for running over her 9-year-old son while dropping him off at school… https://t.co/dtev78ibm6
1119257378908725250,32,42,2019-04-19 15:12:08,"There's a mental health crisis among doctors and it starts in medical school, Dr. Elisabeth Poorman tells… https://t.co/OaHNFe2pkq"
1119257347430469633,17,31,2019-04-19 15:12:01,How to get your partner on board with a healthy lifestyle change. https://t.co/lRDtxIMmfV - @NBCNewsBETTER
1119252943407144962,86,155,2019-04-19 14:54:31,Mueller report: Members of the 2016 Trump campaign had a series of contacts with WikiLeaks and people close to its… https://t.co/sulPrw8n0z
1119251823704072194,48,134,2019-04-19 14:50:04,"Rome's ""Holy Stairs,"" which some Catholics believe were climbed by Jesus in Jerusalem, have been uncovered from a p… https://t.co/hW4gBZt9TX"
1119249580774891520,33,55,2019-04-19 14:41:09,"Mueller report ""found no documentary evidence"" to indicate that President Trump knew ahead of time about the June 2… https://t.co/dOkOmsf6pZ"
1119248810243436544,48,105,2019-04-19 14:38:05,"America's first female astronaut candidate, pilot Jerrie Cobb, has died age 88. https://t.co/2z8Cdxx1M7"
1119247039127277570,224,494,2019-04-19 14:31:03,"Mueller report on obstruction: ""We recognized that a federal criminal accusation against a sitting President would… https://t.co/agn9NAme3v"
1119244824312414209,189,273,2019-04-19 14:22:15,"JUST IN: NOAA: Post-storm analysis of Hurricane Michael, which slammed into the Florida Panhandle in October, has b… https://t.co/Zu5S446nI2"
1119243237997326339,70,182,2019-04-19 14:15:57,"NEW: Advisers to former VP Biden are finalizing plans for the launch of his 2020 presidential campaign next week, e… https://t.co/3UB1r4n1xK"
1119242767488704513,36,35,2019-04-19 14:14:04,"Investigators in California are searching for a missing teenage girl believed to be with her mother and a man, both… https://t.co/VtgUpVhCko"
1119241258956984321,209,160,2019-04-19 14:08:05,"The drinking water in Paradise, California, where 85 people died in the worst wildfire in state history, is contami… https://t.co/Ud8wuwjEgR"
1119239398929895424,42,100,2019-04-19 14:00:41,"Mueller report: ""We recognized that a federal criminal accusation against a sitting President would place burdens o… https://t.co/NqToWChRd4"
1119238469404901377,52,126,2019-04-19 13:57:00,The Mueller report also notes president's attempt to get DNI Coats to say publicly that no link existed between Tru… https://t.co/bV9llcKAkQ
1119237715176894465,37,128,2019-04-19 13:54:00,"Then-FBI Director Comey didn't end the investigation into President Trump's first national security adviser, Michae… https://t.co/c91pkRlFz2"
1119236708313247745,33,123,2019-04-19 13:50:00,"Lewandowski, Mueller wrote, ""did not deliver the President's message to Sessions."" 
1119235764095717376,41,93,2019-04-19 13:46:15,"In his report, Special Counsel Mueller writes that the president, after being rebuffed by McGahn, quickly directed… https://t.co/nn0YmCDkX4"
1119235450449879040,39,84,2019-04-19 13:45:00,"This thread will now examine incidents that are described in the Mueller report:
1119234625396670464,21,58,2019-04-19 13:41:43,"Mueller report on President Trump's actions that were blocked by his aides:
1119234317836783623,51,105,2019-04-19 13:40:30,"Mueller report: ""Our investigation found multiple acts by the President that were capable of exerting undue influen… https://t.co/O92XzVHO2z"
1119233365146730497,138,359,2019-04-19 13:36:43,"#NBCNewsThreads: Analyzing the Mueller report's findings on the obstruction issue: 
1119231434877747202,14,41,2019-04-19 13:29:03,"UNC woman's basketball coach resigns over ""racially insensitive"" comments. https://t.co/tKGfLuGRJ0"
1119231361628483585,85,0,2019-04-19 13:28:45,RT @NBCNews: Journalist Lyra McKee shot dead while reporting on a riot in the Northern Irish city of Londonderry on Thursday. https://t.co/…
1119229729914195969,534,0,2019-04-19 13:22:16,"RT @NBCNews: BREAKING: House Democrats subpoena for full, unredacted Mueller report. https://t.co/M4rPeJC1Ei"
1119227654136373248,26,85,2019-04-19 13:14:01,US Dept. of Housing and Urban Development (HUD) moves to require carbon monoxide detectors in public housing; annou… https://t.co/467obRwdYY
1119226898440232961,534,2424,2019-04-19 13:11:01,"BREAKING: House Democrats subpoena for full, unredacted Mueller report. https://t.co/M4rPeJC1Ei"
1119224912152072192,63,380,2019-04-19 13:03:07,A woman who said she took a photo of a man and a little girl playing outside France’s Notre Dame Cathedral shortly… https://t.co/EJq0koYoSO
1119221884187488256,49,117,2019-04-19 12:51:05,Federal regulators are discussing whether to hold Mark Zuckerberg personally accountable for the company's history… https://t.co/ouHZXfUfbg
1119219625412239361,191,417,2019-04-19 12:42:07,"Pressed this morning to acknowledge she misled the public with her ""countless"" FBI agents comment, Press Sec. Sande… https://t.co/ew0fDReAve"
1119218407990284290,36,0,2019-04-19 12:37:17,"RT @TODAYshow: Investigators believe the fire at Notre Dame Cathedral was likely caused by an electrical short circuit, @kellycobiella repo…"
1119216599754522624,76,230,2019-04-19 12:30:06,Analysis: The special counsel's findings reveal three years of actions by the president that critics say rattle the… https://t.co/VjgmciFuGv
1119213339245195265,116,250,2019-04-19 12:17:08,"Pressed by ABC News this morning to acknowledge she misled the public on this point, Press Sec. Sanders repeats tha… https://t.co/tOPBBoLdW3"
1119212661055598593,35,0,2019-04-19 12:14:27,RT @TODAYshow: Senate Majority Leader Mitch McConnell plans to introduce a new bill that would raise the federal minimum age to buy tobacco…
1119212313138159617,85,87,2019-04-19 12:13:04,Journalist Lyra McKee shot dead while reporting on a riot in the Northern Irish city of Londonderry on Thursday. https://t.co/5Ey8jQzvxU
1119210789745958912,45,83,2019-04-19 12:07:00,"The Mueller report provides extensive evidence of Russian interference in the 2016 US election
1119209540699021312,16,62,2019-04-19 12:02:03,Good Friday will be marked in the shadow of Notre Dame Cathedral with a procession carrying one of the treasures sa… https://t.co/sFaGkHINkS
1119204256383369216,14,33,2019-04-19 11:41:03,"Opinion | Ani Bundel: ""JK Rowling taught her readers to embrace an open, progressive society. A decade later, it's… https://t.co/jkY8FJH1kM"
1119201239617744896,102,249,2019-04-19 11:29:03,Analysis: The special counsel's findings reveal three years of actions by the president that critics say rattle the… https://t.co/mVYESumNse
1119200992644476928,31,0,2019-04-19 11:28:05,"RT @TODAYshow: Just south of Atlanta, there are tornado watches in effect for the next few hours. @dylandreyernbc is tracking the storm sla…"
1119199233024962560,8,20,2019-04-19 11:21:05,"Why ""lawnmower parenting"" is like robbing your kids — and how to actually help them. https://t.co/IOFXBCCuIt - @NBCNewsBETTER"
1119198764382736384,21,0,2019-04-19 11:19:13,RT @TODAYshow: “We’ll probably have to wait for Robert Mueller to testify before Congress to get that answer.” @petewilliamsnbc talks Muell…
1119194699313631232,26,29,2019-04-19 11:03:04,"Three renowned mountain climbers are presumed dead after an avalanche in Alberta's Banff National Park, Canadian of… https://t.co/LmX6vZCiqV"
1119190247047421952,16,0,2019-04-19 10:45:23,RT @TODAYshow: Today on TODAY: The public release of the Mueller report is creating new battles in Washington this morning. We'll break it…
1119186149103292419,22,73,2019-04-19 10:29:06,Soccer players in England launch 24-hour social media boycott over racial abuse. https://t.co/MBJuLKrtiA
1119184380889640960,30,64,2019-04-19 10:22:04,"With the 20th anniversary of the Columbine shooting looming, several grieving parents and survivors sat down with… https://t.co/XM3vrTAQ1B"
1119182375827791872,44,48,2019-04-19 10:14:06,"A journalist was fatally shot while reporting on a riot in the Northern Irish city of Londonderry on Thursday, auth… https://t.co/Wthepn3k5p"
1119179606957936640,324,764,2019-04-19 10:03:06,"White House Press Sec. Sanders told the public that ""countless"" FBI agents had told the White House that they had l… https://t.co/iVhegqhTcE"
1119174804261806080,32,36,2019-04-19 09:44:01,The man who carried a pair of gas cans into St. Patrick’s Cathedral in New York is charged with trying to start a f… https://t.co/kvb56busk4
1119171553290280960,57,147,2019-04-19 09:31:06,"Opinion | Michael Conway: Mueller's report suggests if Trump weren't president, he would've been indicted.… https://t.co/7WiQ5qtjTh"
1119167512124506112,81,238,2019-04-19 09:15:02,Analysis: The special counsel's findings reveal three years of actions by the president that critics say rattle the… https://t.co/NKHJeRgpMT
1119165401940643841,32,48,2019-04-19 09:06:39,"Unvaccinated children are most at risk, but as the disease spreads, more adults are wondering if they are protected… https://t.co/PP57Aof0P5"
1119163999092744197,180,719,2019-04-19 09:01:05,"More than 5,000 people — many of them alumni and current students — have signed a petition urging Taylor Univ. to r… https://t.co/SDOZwdhtqR"
1119160215629258753,82,142,2019-04-19 08:46:03,The redacted Mueller report mentions that he's made criminal referrals in 14 cases. Only two are publicly known. https://t.co/6zB7Eba7Ek
1119155955113938945,50,70,2019-04-19 08:29:07,"GOP Sen. Richard Burr apparently briefed White House on FBI's Russia probe, Mueller report says. https://t.co/eb1s60nfAO"
1119152170962575360,105,266,2019-04-19 08:14:05,"White House Press Sec. Sanders told the public that ""countless"" FBI agents had told the White House that they had l… https://t.co/X2gxW6RF2x"
1119149156818231297,32,202,2019-04-19 08:02:06,A woman who said she took a photo of a man and a little girl playing outside France’s Notre Dame Cathedral shortly… https://t.co/smeta8nto0
1119144884626022404,24,31,2019-04-19 07:45:07,"Two Florida middle school girls allegedly plotted to kill other students they had placed on a ""hit list."" https://t.co/jNscORkajZ"
1119137061376626689,23,31,2019-04-19 07:14:02,"Strong storms have killed two Mississippi drivers and a woman in Alabama while leaving more than 100,000 people wit… https://t.co/jsdn7hwyBX"
1119133576241401858,18,48,2019-04-19 07:00:11,"Opinion | George Johnson: ""We shouldn’t allow our emotions to be monopolized and influenced by the systems that con… https://t.co/3hhL2ur50B"
1119129518092873728,33,141,2019-04-19 06:44:04,"First responders were honored at two ceremonies, with President Macron saying they would receive a medal of honor f… https://t.co/8lla23lnOI"
1119128754247176192,78,199,2019-04-19 06:41:02,"Analysis: Mueller didn't find a conspiracy he could prove, but did show that the Russians and the Trump team pursue… https://t.co/x4or94sbzZ"
1119123739029819394,20,37,2019-04-19 06:21:06,"With the world’s population projected to reach almost 10 billion by 2050, experts are looking for ways to make sure… https://t.co/RDfPQ1Y9VO"
1119120467799855104,17,39,2019-04-19 06:08:06,The National Enquirer sells to Hudson News CEO James Cohen for $100 million. https://t.co/A1NQFGmW88
1119114910829400064,20,46,2019-04-19 05:46:01,"A Tunisian man was sentenced to life in prison for stabbing a police officer at the airport in Flint, Michigan. https://t.co/AcJDOftV90"
1119113167588642816,4,18,2019-04-19 05:39:05,".@NBCNewsBETTER: Whether you're running a marathon, swimming or sweating it out in a group fitness class here is th… https://t.co/25Bvt1NGaH"
1119108140543266821,5,22,2019-04-19 05:19:07,"For now, it’s a research tool. But researchers at the University of California, Berkeley say its human-friendly des… https://t.co/DQi59SYxex"
1119103859014549504,72,77,2019-04-19 05:02:06,"Venezuela continues to struggle under the disputed rule of Nicolas Maduro as hyperinflation, blackouts, and food sh… https://t.co/PjlAFl9Hls"
1119099568883257344,314,227,2019-04-19 04:45:03,"The drinking water in Paradise, California, where 85 people died in the worst wildfire in state history, is contami… https://t.co/GlEHBa8M5i"
1119097799696502785,23,43,2019-04-19 04:38:01,"These books by Chicano, Cuban, Puerto Rican, Colombian and indigenous writers attest to the breadth and diversity o… https://t.co/NZC6iWOSAJ"
1119092023565230080,14,39,2019-04-19 04:15:04,"Feminist spirit powers ""Fast Color,"" a dystopian movie that highlights the supernatural strengths of 3 generations… https://t.co/oQuWtcq9uB"
1119088245269131264,30,75,2019-04-19 04:00:03,"We may not know exactly how or why Stonehenge was built, but new research affords a glimpse of the people who erect… https://t.co/5PQE3atTiJ"
1119085472536383488,97,198,2019-04-19 03:49:02,Federal regulators are discussing whether and how to hold Mark Zuckerberg personally accountable for the company's… https://t.co/Y9UNj6gOzx
1119084209547558913,111,660,2019-04-19 03:44:01,A woman who said she took a photo of a man and a little girl playing outside France’s Notre Dame Cathedral shortly… https://t.co/cbap3CNIEW
1119083470599245825,16,45,2019-04-19 03:41:05,A poll released this week of national Latino voters has Julián Castro with the 4th-highest favorability rating amon… https://t.co/v9jFPj6VpV
1119077690110291968,22,33,2019-04-19 03:18:07,"BMW is adding nearly 185,000 vehicles to a 2017 recall for possible engine fires.
1119076686224592896,59,47,2019-04-19 03:14:08,"In West Texas, an oil boom is creating a major problem for producers and locals alike: wasting natural gas by burni… https://t.co/F7Db3qeR2n"
1119075400464912386,55,74,2019-04-19 03:09:01,"The show will take a ""deep, nuanced look"" at members of the secret group that is under federal investigation. https://t.co/8CjBmJMsMA"
1119073397370236928,33,79,2019-04-19 03:01:03,"WATCH: Tired of living in fear of their own police, residents of Vallejo, California, are demanding action and taki… https://t.co/h9PAM3HlbB"
1119069880299466753,57,108,2019-04-19 02:47:05,"""Some defendants, posing as U.S. persons and without revealing their Russian association, communicated with unwitti… https://t.co/dGuhStiFHj"
1119068104439554048,95,140,2019-04-19 02:40:02,"Paul Manafort told his associate, Rick Gates, that one of president's personal lawyers promised to ""take care of us… https://t.co/KWmrLpYAmR"
1119063081986949122,6,9,2019-04-19 02:20:04,"""With the thump and being startled, I went straight to, 'This could be an ambush,'"" Officer Matthew Harrity testifi… https://t.co/siC0pRLoWK"
1119061821678325760,41,195,2019-04-19 02:15:04,"Dozens of same sex couples kissed simultaneously outside an upscale shopping mall in Colombia's capital, in the lat… https://t.co/DIaIXaVnGd"
1119058547436863490,8,23,2019-04-19 02:02:03,".@NBCNewsBETTER: Once you’ve organized your financial life and you’re saving for retirement, you’re poised to start… https://t.co/jPx4MGOCNZ"
1119054751436627969,10,30,2019-04-19 01:46:58,WATCH: Officials and lawmakers react to Special Counsel Mueller's redacted report. https://t.co/fhiwpycUnD
1119052765496582149,55,95,2019-04-19 01:39:04,"Opinion | F. Diane Barth: ""Denying reality, or not crediting something we know is true, is a way to unconsciously p… https://t.co/Z7DfRHYgQY"
1119046719533199361,74,52,2019-04-19 01:15:03,Facebook said millions of Instagram user passwords were exposed to employees in a searchable format in an internal… https://t.co/mjipElr0QB
1119042955745091584,24,32,2019-04-19 01:00:06,"Opinion | Dr. Elisabeth Poorman: ""Depression in medicine is incredibly common and it really begins in medical schoo… https://t.co/TdhSHns7h7"
1119039186676408320,51,33,2019-04-19 00:45:07,"Two Florida middle school girls allegedly plotted to kill other students they had placed on a ""hit list."" https://t.co/jcKGXpgVW9"
1119037897892487168,32,88,2019-04-19 00:40:00,Mueller’s redacted report revealed White House Press Sec. Sarah Sanders said she made a claim about former FBI Dir.… https://t.co/brkOWHhxYX
1119032882163539970,23,29,2019-04-19 00:20:04,"US Health Dept. proposes nixing data collection on LGBTQ foster youth, reversing an Obama-era rule. https://t.co/Ab0sL2DM0N"
1119030618938052608,110,139,2019-04-19 00:11:04,"President Trump has arrived at Mar-a-Lago, marking the 243rd day at one of his properties since taking office.… https://t.co/jJoSXAeHwq"
1119028350863990785,51,42,2019-04-19 00:02:04,"Same-sex borrowers 73% more likely to be denied mortgage, study finds - @NBCOUT https://t.co/UdLWFNaVGK"
1119025591829897218,40,109,2019-04-18 23:51:06,A judge dismissed a lawsuit that challenged an emergency declaration in New York City requiring residents of certai… https://t.co/L4m7Ug1Jzu
1119022830006546433,137,338,2019-04-18 23:40:07,The redacted Mueller report mentions that he's made criminal referrals in 14 cases. Only two are publicly known. https://t.co/B6blpl9fJW
1119016524767989765,190,719,2019-04-18 23:15:04,"More than 5,000 people — many of them alumni and current students — have signed a petition urging Taylor Univ. to r… https://t.co/X1vT8KbHdO"
1119015024792678400,144,180,2019-04-18 23:09:06,"GOP Sen. Richard Burr apparently briefed White House on FBI's Russia probe, Mueller report says. https://t.co/211F8ZfzM0"
1119012768617725954,15,15,2019-04-18 23:00:08,"Changes to NAFTA would modestly boost U.S. economic and jobs growth, according to a report from the International T… https://t.co/vo9g4i2s3b"
1119008941772505089,44,41,2019-04-18 22:44:56,"Unvaccinated children are most at risk, but as the disease spreads, more adults are wondering if they are protected… https://t.co/9Kq8H4XSns"
1119005351456559104,9,0,2019-04-18 22:30:40,RT @NBCNightlyNews: NOW: @LesterHoltNBC anchors @NBCNightlyNews from Rockefeller Center for most of our viewers in the Eastern and Central…
1119001924777410562,3,3,2019-04-18 22:17:03,How a startup wants to use AI to catch shoplifters in the act. https://t.co/Gcn7GOfpv9 - @NBCNewsMACH
1118998653501419520,48,164,2019-04-18 22:04:03,"Dozens of same sex couples in Bogota, Colombia, stage a kiss-a-thon in support of LGBTQ rights. https://t.co/VLQh2LGgw0"
1118996135954325504,276,565,2019-04-18 21:54:03,"White House Press Sec. Sanders told the public that ""countless"" FBI agents had told the White House that they had l… https://t.co/MOgzR9mnGV"
1118993136200634368,14,42,2019-04-18 21:42:08,How to cope when a friend breaks up with you. https://t.co/d2U1tSdxXw - @NBCNewsBETTER
1118988331155623949,18,30,2019-04-18 21:23:02,"The Ohio man who pretended to be missing Timmothy Pitzen faces new charges, including identity theft. https://t.co/mdnt5RBNsc"
1118987441837346817,39,88,2019-04-18 21:19:30,"Mueller's report states that investigators were unable to establish that President Trump ""directed or aided"" Michae… https://t.co/qxlzOULAU6"
1118984312697905152,19,28,2019-04-18 21:07:04,"The almost 2-month search at a Colorado landfill for the remains of Kelsey Barreth has ended, police say. https://t.co/xsSi1ZXd1B"
1118979540502700033,31,70,2019-04-18 20:48:06,Soccer players in England launch 24-hour social media boycott over racial abuse. https://t.co/ssur0FAhha
1118977261628284928,238,534,2019-04-18 20:39:03,"Press Sec. Sanders told press after Comey's firing that the WH heard from ""countless"" FBI agents who said they had… https://t.co/zktSKvqo51"
1118975456018075663,154,0,2019-04-18 20:31:52,"RT @NBCNews: Mueller report released to public contains nearly 1,000 redactions, with 7 pages blacked-out completely. https://t.co/4Llf7GFa…"
1118972745042284545,24,71,2019-04-18 20:21:06,Senate Majority Leader McConnell announces he will introduce legislation aimed at raising the national smoking age… https://t.co/8CgZlaMXNi
1118972427923525633,138,466,2019-04-18 20:19:50,"President Trump walks from the White House to Marine One, bypassing the press with no comment about the release of… https://t.co/gCFtDmuUgd"
1118970978804150272,24,57,2019-04-18 20:14:05,Rapper Kodak Black arrested at US-Canada border on gun and marijuana charges https://t.co/zwTHXtZml2
